{
  "schema": "vitamux.lab.extraction/1",
  "synthetic": true,
  "document": {
    "laboratory": "Oskelund Analytics",
    "specimen_type": "Serum",
    "collected_at": "2025-03-31T08:37",
    "collected_at_text": "2025-03-31 08:37",
    "reported_at": "2025-04-01T13:53",
    "reported_at_text": "2025-04-01 13:53",
    "page_count": 1
  },
  "rows": [
    {
      "page": 1,
      "row_index": 0,
      "analyte_label": "Glucose, fasting",
      "value_text": "4.4",
      "value_numeric": 4.4,
      "comparator": null,
      "unit_text": "mmol/L",
      "reference_range_text": "3.9 - 5.5",
      "ref_low": 3.9,
      "ref_high": 5.5,
      "printed_flag": null,
      "specimen_type": "Serum",
      "collected_at": "2025-03-31T08:37",
      "reported_at": "2025-04-01T13:53",
      "laboratory": "Oskelund Analytics",
      "evidence_text": "Glucose, fasting 4.4 mmol/L 3.9 - 5.5",
      "bbox": {
        "x0": 0.0672,
        "y0": 0.189,
        "x1": 0.6773,
        "y1": 0.1997
      },
      "confidence": 1,
      "warnings": []
    },
    {
      "page": 1,
      "row_index": 1,
      "analyte_label": "Urea",
      "value_text": "5.3",
      "value_numeric": 5.3,
      "comparator": null,
      "unit_text": "mmol/L",
      "reference_range_text": "2.5 - 7.8",
      "ref_low": 2.5,
      "ref_high": 7.8,
      "printed_flag": null,
      "specimen_type": "Serum",
      "collected_at": "2025-03-31T08:37",
      "reported_at": "2025-04-01T13:53",
      "laboratory": "Oskelund Analytics",
      "evidence_text": "Urea 5.3 mmol/L 2.5 - 7.8",
      "bbox": {
        "x0": 0.0672,
        "y0": 0.2057,
        "x1": 0.6773,
        "y1": 0.2163
      },
      "confidence": 1,
      "warnings": []
    },
    {
      "page": 1,
      "row_index": 2,
      "analyte_label": "Creatinine",
      "value_text": "76",
      "value_numeric": 76,
      "comparator": null,
      "unit_text": "µmol/L",
      "reference_range_text": "59 - 104",
      "ref_low": 59,
      "ref_high": 104,
      "printed_flag": null,
      "specimen_type": "Serum",
      "collected_at": "2025-03-31T08:37",
      "reported_at": "2025-04-01T13:53",
      "laboratory": "Oskelund Analytics",
      "evidence_text": "Creatinine 76 µmol/L 59 - 104",
      "bbox": {
        "x0": 0.0672,
        "y0": 0.2223,
        "x1": 0.6773,
        "y1": 0.233
      },
      "confidence": 1,
      "warnings": []
    },
    {
      "page": 1,
      "row_index": 3,
      "analyte_label": "Sodium",
      "value_text": "138",
      "value_numeric": 138,
      "comparator": null,
      "unit_text": "mmol/L",
      "reference_range_text": "136 - 145",
      "ref_low": 136,
      "ref_high": 145,
      "printed_flag": null,
      "specimen_type": "Serum",
      "collected_at": "2025-03-31T08:37",
      "reported_at": "2025-04-01T13:53",
      "laboratory": "Oskelund Analytics",
      "evidence_text": "Sodium 138 mmol/L 136 - 145",
      "bbox": {
        "x0": 0.0672,
        "y0": 0.2389,
        "x1": 0.6858,
        "y1": 0.2496
      },
      "confidence": 1,
      "warnings": []
    },
    {
      "page": 1,
      "row_index": 4,
      "analyte_label": "Potassium",
      "value_text": "4.2",
      "value_numeric": 4.2,
      "comparator": null,
      "unit_text": "mmol/L",
      "reference_range_text": "3.5 - 5.1",
      "ref_low": 3.5,
      "ref_high": 5.1,
      "printed_flag": null,
      "specimen_type": "Serum",
      "collected_at": "2025-03-31T08:37",
      "reported_at": "2025-04-01T13:53",
      "laboratory": "Oskelund Analytics",
      "evidence_text": "Potassium 4.2 mmol/L 3.5 - 5.1",
      "bbox": {
        "x0": 0.0672,
        "y0": 0.2555,
        "x1": 0.6773,
        "y1": 0.2662
      },
      "confidence": 1,
      "warnings": []
    },
    {
      "page": 1,
      "row_index": 5,
      "analyte_label": "Calcium",
      "value_text": "2.30",
      "value_numeric": 2.3,
      "comparator": null,
      "unit_text": "mmol/L",
      "reference_range_text": "2.15 - 2.55",
      "ref_low": 2.15,
      "ref_high": 2.55,
      "printed_flag": null,
      "specimen_type": "Serum",
      "collected_at": "2025-03-31T08:37",
      "reported_at": "2025-04-01T13:53",
      "laboratory": "Oskelund Analytics",
      "evidence_text": "Calcium 2.30 mmol/L 2.15 - 2.55",
      "bbox": {
        "x0": 0.0672,
        "y0": 0.2722,
        "x1": 0.6942,
        "y1": 0.2829
      },
      "confidence": 1,
      "warnings": []
    },
    {
      "page": 1,
      "row_index": 6,
      "analyte_label": "Magnesium",
      "value_text": "0.95",
      "value_numeric": 0.95,
      "comparator": null,
      "unit_text": "mmol/L",
      "reference_range_text": "0.70 - 1.00",
      "ref_low": 0.7,
      "ref_high": 1,
      "printed_flag": null,
      "specimen_type": "Serum",
      "collected_at": "2025-03-31T08:37",
      "reported_at": "2025-04-01T13:53",
      "laboratory": "Oskelund Analytics",
      "evidence_text": "Magnesium 0.95 mmol/L 0.70 - 1.00",
      "bbox": {
        "x0": 0.0672,
        "y0": 0.2888,
        "x1": 0.6942,
        "y1": 0.2995
      },
      "confidence": 1,
      "warnings": []
    },
    {
      "page": 1,
      "row_index": 7,
      "analyte_label": "Phosphate",
      "value_text": "0.90",
      "value_numeric": 0.9,
      "comparator": null,
      "unit_text": "mmol/L",
      "reference_range_text": "0.81 - 1.45",
      "ref_low": 0.81,
      "ref_high": 1.45,
      "printed_flag": null,
      "specimen_type": "Serum",
      "collected_at": "2025-03-31T08:37",
      "reported_at": "2025-04-01T13:53",
      "laboratory": "Oskelund Analytics",
      "evidence_text": "Phosphate 0.90 mmol/L 0.81 - 1.45",
      "bbox": {
        "x0": 0.0672,
        "y0": 0.3054,
        "x1": 0.6942,
        "y1": 0.3161
      },
      "confidence": 1,
      "warnings": []
    },
    {
      "page": 1,
      "row_index": 8,
      "analyte_label": "Uric acid",
      "value_text": "425",
      "value_numeric": 425,
      "comparator": null,
      "unit_text": "µmol/L",
      "reference_range_text": "200 - 430",
      "ref_low": 200,
      "ref_high": 430,
      "printed_flag": null,
      "specimen_type": "Serum",
      "collected_at": "2025-03-31T08:37",
      "reported_at": "2025-04-01T13:53",
      "laboratory": "Oskelund Analytics",
      "evidence_text": "Uric acid 425 µmol/L 200 - 430",
      "bbox": {
        "x0": 0.0672,
        "y0": 0.322,
        "x1": 0.6858,
        "y1": 0.3327
      },
      "confidence": 1,
      "warnings": []
    },
    {
      "page": 1,
      "row_index": 9,
      "analyte_label": "Bilirubin, total",
      "value_text": "2",
      "value_numeric": 2,
      "comparator": null,
      "unit_text": "µmol/L",
      "reference_range_text": "5 - 21",
      "ref_low": 5,
      "ref_high": 21,
      "printed_flag": "L",
      "specimen_type": "Serum",
      "collected_at": "2025-03-31T08:37",
      "reported_at": "2025-04-01T13:53",
      "laboratory": "Oskelund Analytics",
      "evidence_text": "Bilirubin, total 2 µmol/L 5 - 21 L",
      "bbox": {
        "x0": 0.0672,
        "y0": 0.3387,
        "x1": 0.8319,
        "y1": 0.3494
      },
      "confidence": 1,
      "warnings": []
    },
    {
      "page": 1,
      "row_index": 10,
      "analyte_label": "ALT",
      "value_text": "42",
      "value_numeric": 42,
      "comparator": null,
      "unit_text": "U/L",
      "reference_range_text": "< 50",
      "ref_low": null,
      "ref_high": 50,
      "printed_flag": null,
      "specimen_type": "Serum",
      "collected_at": "2025-03-31T08:37",
      "reported_at": "2025-04-01T13:53",
      "laboratory": "Oskelund Analytics",
      "evidence_text": "ALT 42 U/L < 50",
      "bbox": {
        "x0": 0.0672,
        "y0": 0.3553,
        "x1": 0.6517,
        "y1": 0.366
      },
      "confidence": 1,
      "warnings": []
    },
    {
      "page": 1,
      "row_index": 11,
      "analyte_label": "GGT",
      "value_text": "21",
      "value_numeric": 21,
      "comparator": null,
      "unit_text": "U/L",
      "reference_range_text": "< 60",
      "ref_low": null,
      "ref_high": 60,
      "printed_flag": null,
      "specimen_type": "Serum",
      "collected_at": "2025-03-31T08:37",
      "reported_at": "2025-04-01T13:53",
      "laboratory": "Oskelund Analytics",
      "evidence_text": "GGT 21 U/L < 60",
      "bbox": {
        "x0": 0.0672,
        "y0": 0.3719,
        "x1": 0.6517,
        "y1": 0.3826
      },
      "confidence": 1,
      "warnings": []
    },
    {
      "page": 1,
      "row_index": 12,
      "analyte_label": "CRP",
      "value_text": "< 0.6",
      "value_numeric": 0.6,
      "comparator": "<",
      "unit_text": "mg/L",
      "reference_range_text": "< 5.0",
      "ref_low": null,
      "ref_high": 5,
      "printed_flag": null,
      "specimen_type": "Serum",
      "collected_at": "2025-03-31T08:37",
      "reported_at": "2025-04-01T13:53",
      "laboratory": "Oskelund Analytics",
      "evidence_text": "CRP < 0.6 mg/L < 5.0",
      "bbox": {
        "x0": 0.0672,
        "y0": 0.3886,
        "x1": 0.6559,
        "y1": 0.3992
      },
      "confidence": 1,
      "warnings": []
    }
  ],
  "warnings": []
}
