{
  "schema": "vitamux.lab.extraction/1",
  "synthetic": true,
  "document": {
    "laboratory": "Pellucid Fixture Lab",
    "specimen_type": "Serum",
    "collected_at": "2025-10-03T08:55",
    "collected_at_text": "2025-10-03 08:55",
    "reported_at": "2025-10-04T12:06",
    "reported_at_text": "2025-10-04 12:06",
    "page_count": 1
  },
  "rows": [
    {
      "page": 1,
      "row_index": 0,
      "analyte_label": "Cholesterol, total",
      "value_text": "4.7",
      "value_numeric": 4.7,
      "comparator": null,
      "unit_text": "mmol/L",
      "reference_range_text": "< 5.0",
      "ref_low": null,
      "ref_high": 5,
      "printed_flag": null,
      "specimen_type": "Serum",
      "collected_at": "2025-10-03T08:55",
      "reported_at": "2025-10-04T12:06",
      "laboratory": "Pellucid Fixture Lab",
      "evidence_text": "Cholesterol, total 4.7 mmol/L < 5.0",
      "bbox": {
        "x0": 0.0672,
        "y0": 0.2104,
        "x1": 0.6559,
        "y1": 0.2211
      },
      "confidence": 1,
      "warnings": []
    },
    {
      "page": 1,
      "row_index": 1,
      "analyte_label": "LDL-C",
      "value_text": "2.6",
      "value_numeric": 2.6,
      "comparator": null,
      "unit_text": "mmol/L",
      "reference_range_text": "< 3.0",
      "ref_low": null,
      "ref_high": 3,
      "printed_flag": null,
      "specimen_type": "Serum",
      "collected_at": "2025-10-03T08:55",
      "reported_at": "2025-10-04T12:06",
      "laboratory": "Pellucid Fixture Lab",
      "evidence_text": "LDL-C 2.6 mmol/L < 3.0",
      "bbox": {
        "x0": 0.0672,
        "y0": 0.227,
        "x1": 0.6559,
        "y1": 0.2377
      },
      "confidence": 1,
      "warnings": []
    },
    {
      "page": 1,
      "row_index": 2,
      "analyte_label": "HDL-C",
      "value_text": "1.1",
      "value_numeric": 1.1,
      "comparator": null,
      "unit_text": "mmol/L",
      "reference_range_text": "> 1.0",
      "ref_low": 1,
      "ref_high": null,
      "printed_flag": null,
      "specimen_type": "Serum",
      "collected_at": "2025-10-03T08:55",
      "reported_at": "2025-10-04T12:06",
      "laboratory": "Pellucid Fixture Lab",
      "evidence_text": "HDL-C 1.1 mmol/L > 1.0",
      "bbox": {
        "x0": 0.0672,
        "y0": 0.2437,
        "x1": 0.6559,
        "y1": 0.2543
      },
      "confidence": 1,
      "warnings": []
    },
    {
      "page": 1,
      "row_index": 3,
      "analyte_label": "Triglycerides",
      "value_text": "0.4",
      "value_numeric": 0.4,
      "comparator": null,
      "unit_text": "mmol/L",
      "reference_range_text": "< 1.7",
      "ref_low": null,
      "ref_high": 1.7,
      "printed_flag": null,
      "specimen_type": "Serum",
      "collected_at": "2025-10-03T08:55",
      "reported_at": "2025-10-04T12:06",
      "laboratory": "Pellucid Fixture Lab",
      "evidence_text": "Triglycerides 0.4 mmol/L < 1.7",
      "bbox": {
        "x0": 0.0672,
        "y0": 0.2603,
        "x1": 0.6559,
        "y1": 0.271
      },
      "confidence": 1,
      "warnings": []
    },
    {
      "page": 1,
      "row_index": 4,
      "analyte_label": "ApoB",
      "value_text": "0.98",
      "value_numeric": 0.98,
      "comparator": null,
      "unit_text": "g/L",
      "reference_range_text": "0.55 - 1.20",
      "ref_low": 0.55,
      "ref_high": 1.2,
      "printed_flag": null,
      "specimen_type": "Serum",
      "collected_at": "2025-10-03T08:55",
      "reported_at": "2025-10-04T12:06",
      "laboratory": "Pellucid Fixture Lab",
      "evidence_text": "ApoB 0.98 g/L 0.55 - 1.20",
      "bbox": {
        "x0": 0.0672,
        "y0": 0.2769,
        "x1": 0.6942,
        "y1": 0.2876
      },
      "confidence": 1,
      "warnings": []
    },
    {
      "page": 1,
      "row_index": 5,
      "analyte_label": "Lipoprotein(a)",
      "value_text": "63",
      "value_numeric": 63,
      "comparator": null,
      "unit_text": "nmol/L",
      "reference_range_text": "< 75",
      "ref_low": null,
      "ref_high": 75,
      "printed_flag": null,
      "specimen_type": "Serum",
      "collected_at": "2025-10-03T08:55",
      "reported_at": "2025-10-04T12:06",
      "laboratory": "Pellucid Fixture Lab",
      "evidence_text": "Lipoprotein(a) 63 nmol/L < 75",
      "bbox": {
        "x0": 0.0672,
        "y0": 0.2935,
        "x1": 0.6517,
        "y1": 0.3042
      },
      "confidence": 1,
      "warnings": []
    },
    {
      "page": 1,
      "row_index": 6,
      "analyte_label": "Lp-PLA2 activity",
      "value_text": "140",
      "value_numeric": 140,
      "comparator": null,
      "unit_text": "nmol/min/mL",
      "reference_range_text": "< 225",
      "ref_low": null,
      "ref_high": 225,
      "printed_flag": null,
      "specimen_type": "Serum",
      "collected_at": "2025-10-03T08:55",
      "reported_at": "2025-10-04T12:06",
      "laboratory": "Pellucid Fixture Lab",
      "evidence_text": "Lp-PLA2 activity 140 nmol/min/mL < 225",
      "bbox": {
        "x0": 0.0672,
        "y0": 0.3102,
        "x1": 0.6601,
        "y1": 0.3209
      },
      "confidence": 1,
      "warnings": []
    },
    {
      "page": 1,
      "row_index": 7,
      "analyte_label": "Glucose",
      "value_text": "5.4",
      "value_numeric": 5.4,
      "comparator": null,
      "unit_text": "mmol/L",
      "reference_range_text": "3.9 - 5.5",
      "ref_low": 3.9,
      "ref_high": 5.5,
      "printed_flag": null,
      "specimen_type": "Serum",
      "collected_at": "2025-10-03T08:55",
      "reported_at": "2025-10-04T12:06",
      "laboratory": "Pellucid Fixture Lab",
      "evidence_text": "Glucose 5.4 mmol/L 3.9 - 5.5",
      "bbox": {
        "x0": 0.0672,
        "y0": 0.3672,
        "x1": 0.6773,
        "y1": 0.3779
      },
      "confidence": 1,
      "warnings": []
    },
    {
      "page": 1,
      "row_index": 8,
      "analyte_label": "HbA1c (IFCC)",
      "value_text": "27",
      "value_numeric": 27,
      "comparator": null,
      "unit_text": "mmol/mol",
      "reference_range_text": "20 - 42",
      "ref_low": 20,
      "ref_high": 42,
      "printed_flag": null,
      "specimen_type": "Serum",
      "collected_at": "2025-10-03T08:55",
      "reported_at": "2025-10-04T12:06",
      "laboratory": "Pellucid Fixture Lab",
      "evidence_text": "HbA1c (IFCC) 27 mmol/mol 20 - 42",
      "bbox": {
        "x0": 0.0672,
        "y0": 0.3838,
        "x1": 0.6689,
        "y1": 0.3945
      },
      "confidence": 1,
      "warnings": []
    },
    {
      "page": 1,
      "row_index": 9,
      "analyte_label": "HbA1c (DCCT)",
      "value_text": "4.6",
      "value_numeric": 4.6,
      "comparator": null,
      "unit_text": "%",
      "reference_range_text": "4.0 - 6.0",
      "ref_low": 4,
      "ref_high": 6,
      "printed_flag": null,
      "specimen_type": "Serum",
      "collected_at": "2025-10-03T08:55",
      "reported_at": "2025-10-04T12:06",
      "laboratory": "Pellucid Fixture Lab",
      "evidence_text": "HbA1c (DCCT) 4.6 % 4.0 - 6.0",
      "bbox": {
        "x0": 0.0672,
        "y0": 0.4004,
        "x1": 0.6773,
        "y1": 0.4111
      },
      "confidence": 1,
      "warnings": []
    }
  ],
  "warnings": []
}
