{
  "schema": "vitamux.lab.extraction/1",
  "synthetic": true,
  "document": {
    "laboratory": "Lumenfold Diagnostics",
    "specimen_type": "Serum",
    "collected_at": "2025-06-04T10:36",
    "collected_at_text": "2025-06-04 10:36",
    "reported_at": "2025-06-05T15:57",
    "reported_at_text": "2025-06-05 15:57",
    "page_count": 1
  },
  "rows": [
    {
      "page": 1,
      "row_index": 0,
      "analyte_label": "ALT",
      "value_text": "45",
      "value_numeric": 45,
      "comparator": null,
      "unit_text": "U/L",
      "reference_range_text": "10-50",
      "ref_low": 10,
      "ref_high": 50,
      "printed_flag": null,
      "specimen_type": "Serum",
      "collected_at": "2025-06-04T10:36",
      "reported_at": "2025-06-05T15:57",
      "laboratory": "Lumenfold Diagnostics",
      "evidence_text": "ALT 45 U/L 10-50",
      "bbox": {
        "x0": 0.0672,
        "y0": 0.2113,
        "x1": 0.4209,
        "y1": 0.2208
      },
      "confidence": 1,
      "warnings": []
    },
    {
      "page": 1,
      "row_index": 1,
      "analyte_label": "AST",
      "value_text": "20",
      "value_numeric": 20,
      "comparator": null,
      "unit_text": "U/L",
      "reference_range_text": "10-50",
      "ref_low": 10,
      "ref_high": 50,
      "printed_flag": null,
      "specimen_type": "Serum",
      "collected_at": "2025-06-04T10:36",
      "reported_at": "2025-06-05T15:57",
      "laboratory": "Lumenfold Diagnostics",
      "evidence_text": "AST 20 U/L 10-50",
      "bbox": {
        "x0": 0.0672,
        "y0": 0.2279,
        "x1": 0.4209,
        "y1": 0.2374
      },
      "confidence": 1,
      "warnings": []
    },
    {
      "page": 1,
      "row_index": 2,
      "analyte_label": "ALP",
      "value_text": "125",
      "value_numeric": 125,
      "comparator": null,
      "unit_text": "U/L",
      "reference_range_text": "40-130",
      "ref_low": 40,
      "ref_high": 130,
      "printed_flag": null,
      "specimen_type": "Serum",
      "collected_at": "2025-06-04T10:36",
      "reported_at": "2025-06-05T15:57",
      "laboratory": "Lumenfold Diagnostics",
      "evidence_text": "ALP 125 U/L 40-130",
      "bbox": {
        "x0": 0.0672,
        "y0": 0.2446,
        "x1": 0.4284,
        "y1": 0.2541
      },
      "confidence": 1,
      "warnings": []
    },
    {
      "page": 1,
      "row_index": 3,
      "analyte_label": "GGT",
      "value_text": "49",
      "value_numeric": 49,
      "comparator": null,
      "unit_text": "U/L",
      "reference_range_text": "10-71",
      "ref_low": 10,
      "ref_high": 71,
      "printed_flag": null,
      "specimen_type": "Serum",
      "collected_at": "2025-06-04T10:36",
      "reported_at": "2025-06-05T15:57",
      "laboratory": "Lumenfold Diagnostics",
      "evidence_text": "GGT 49 U/L 10-71",
      "bbox": {
        "x0": 0.0672,
        "y0": 0.2612,
        "x1": 0.4209,
        "y1": 0.2707
      },
      "confidence": 1,
      "warnings": []
    },
    {
      "page": 1,
      "row_index": 4,
      "analyte_label": "Bilirubin, total",
      "value_text": "17",
      "value_numeric": 17,
      "comparator": null,
      "unit_text": "µmol/L",
      "reference_range_text": "5-21",
      "ref_low": 5,
      "ref_high": 21,
      "printed_flag": null,
      "specimen_type": "Serum",
      "collected_at": "2025-06-04T10:36",
      "reported_at": "2025-06-05T15:57",
      "laboratory": "Lumenfold Diagnostics",
      "evidence_text": "Bilirubin, total 17 µmol/L 5-21",
      "bbox": {
        "x0": 0.0672,
        "y0": 0.2778,
        "x1": 0.4135,
        "y1": 0.2873
      },
      "confidence": 1,
      "warnings": []
    },
    {
      "page": 1,
      "row_index": 5,
      "analyte_label": "Albumin",
      "value_text": "50",
      "value_numeric": 50,
      "comparator": null,
      "unit_text": "g/L",
      "reference_range_text": "35-52",
      "ref_low": 35,
      "ref_high": 52,
      "printed_flag": null,
      "specimen_type": "Serum",
      "collected_at": "2025-06-04T10:36",
      "reported_at": "2025-06-05T15:57",
      "laboratory": "Lumenfold Diagnostics",
      "evidence_text": "Albumin 50 g/L 35-52",
      "bbox": {
        "x0": 0.0672,
        "y0": 0.2944,
        "x1": 0.4209,
        "y1": 0.3039
      },
      "confidence": 1,
      "warnings": []
    },
    {
      "page": 1,
      "row_index": 6,
      "analyte_label": "Total protein",
      "value_text": "77",
      "value_numeric": 77,
      "comparator": null,
      "unit_text": "g/L",
      "reference_range_text": "64-83",
      "ref_low": 64,
      "ref_high": 83,
      "printed_flag": null,
      "specimen_type": "Serum",
      "collected_at": "2025-06-04T10:36",
      "reported_at": "2025-06-05T15:57",
      "laboratory": "Lumenfold Diagnostics",
      "evidence_text": "Total protein 77 g/L 64-83",
      "bbox": {
        "x0": 0.0672,
        "y0": 0.3111,
        "x1": 0.4209,
        "y1": 0.3206
      },
      "confidence": 1,
      "warnings": []
    },
    {
      "page": 1,
      "row_index": 7,
      "analyte_label": "Creatinine",
      "value_text": "80",
      "value_numeric": 80,
      "comparator": null,
      "unit_text": "µmol/L",
      "reference_range_text": "62-106",
      "ref_low": 62,
      "ref_high": 106,
      "printed_flag": null,
      "specimen_type": "Serum",
      "collected_at": "2025-06-04T10:36",
      "reported_at": "2025-06-05T15:57",
      "laboratory": "Lumenfold Diagnostics",
      "evidence_text": "Creatinine 80 µmol/L 62-106",
      "bbox": {
        "x0": 0.521,
        "y0": 0.2113,
        "x1": 0.8822,
        "y1": 0.2208
      },
      "confidence": 1,
      "warnings": []
    },
    {
      "page": 1,
      "row_index": 8,
      "analyte_label": "Urea",
      "value_text": "5.1",
      "value_numeric": 5.1,
      "comparator": null,
      "unit_text": "mmol/L",
      "reference_range_text": "2.8-8.1",
      "ref_low": 2.8,
      "ref_high": 8.1,
      "printed_flag": null,
      "specimen_type": "Serum",
      "collected_at": "2025-06-04T10:36",
      "reported_at": "2025-06-05T15:57",
      "laboratory": "Lumenfold Diagnostics",
      "evidence_text": "Urea 5.1 mmol/L 2.8-8.1",
      "bbox": {
        "x0": 0.521,
        "y0": 0.2279,
        "x1": 0.8822,
        "y1": 0.2374
      },
      "confidence": 1,
      "warnings": []
    },
    {
      "page": 1,
      "row_index": 9,
      "analyte_label": "Sodium",
      "value_text": "145",
      "value_numeric": 145,
      "comparator": null,
      "unit_text": "mmol/L",
      "reference_range_text": "136-145",
      "ref_low": 136,
      "ref_high": 145,
      "printed_flag": null,
      "specimen_type": "Serum",
      "collected_at": "2025-06-04T10:36",
      "reported_at": "2025-06-05T15:57",
      "laboratory": "Lumenfold Diagnostics",
      "evidence_text": "Sodium 145 mmol/L 136-145",
      "bbox": {
        "x0": 0.521,
        "y0": 0.2446,
        "x1": 0.8897,
        "y1": 0.2541
      },
      "confidence": 1,
      "warnings": []
    },
    {
      "page": 1,
      "row_index": 10,
      "analyte_label": "Potassium",
      "value_text": "5.1",
      "value_numeric": 5.1,
      "comparator": null,
      "unit_text": "mmol/L",
      "reference_range_text": "3.5-5.1",
      "ref_low": 3.5,
      "ref_high": 5.1,
      "printed_flag": null,
      "specimen_type": "Serum",
      "collected_at": "2025-06-04T10:36",
      "reported_at": "2025-06-05T15:57",
      "laboratory": "Lumenfold Diagnostics",
      "evidence_text": "Potassium 5.1 mmol/L 3.5-5.1",
      "bbox": {
        "x0": 0.521,
        "y0": 0.2612,
        "x1": 0.8822,
        "y1": 0.2707
      },
      "confidence": 1,
      "warnings": []
    },
    {
      "page": 1,
      "row_index": 11,
      "analyte_label": "Cystatin C",
      "value_text": "0.71",
      "value_numeric": 0.71,
      "comparator": null,
      "unit_text": "mg/L",
      "reference_range_text": "0.61-0.95",
      "ref_low": 0.61,
      "ref_high": 0.95,
      "printed_flag": null,
      "specimen_type": "Serum",
      "collected_at": "2025-06-04T10:36",
      "reported_at": "2025-06-05T15:57",
      "laboratory": "Lumenfold Diagnostics",
      "evidence_text": "Cystatin C 0.71 mg/L 0.61-0.95",
      "bbox": {
        "x0": 0.521,
        "y0": 0.2778,
        "x1": 0.8971,
        "y1": 0.2873
      },
      "confidence": 1,
      "warnings": []
    }
  ],
  "warnings": []
}
