{
  "schema": "vitamux.lab.extraction/1",
  "synthetic": true,
  "document": {
    "laboratory": "Quillmarsh Reference Lab",
    "specimen_type": "Citrate plasma",
    "collected_at": "2025-06-02T07:52",
    "collected_at_text": "Jun 2, 2025 7:52 AM",
    "reported_at": "2025-06-03T12:09",
    "reported_at_text": "Jun 3, 2025 12:09 PM",
    "page_count": 1
  },
  "rows": [
    {
      "page": 1,
      "row_index": 0,
      "analyte_label": "D-Dimer",
      "value_text": "≤ 0.19",
      "value_numeric": 0.19,
      "comparator": "<=",
      "unit_text": "µg/mL FEU",
      "reference_range_text": "< 0.50",
      "ref_low": null,
      "ref_high": 0.5,
      "printed_flag": null,
      "specimen_type": "Citrate plasma",
      "collected_at": "2025-06-02T07:52",
      "reported_at": "2025-06-03T12:09",
      "laboratory": "Quillmarsh Reference Lab",
      "evidence_text": "D-Dimer Result: ≤ 0.19 µg/mL FEU Reference: < 0.50",
      "bbox": {
        "x0": 0.0654,
        "y0": 0.1858,
        "x1": 0.5258,
        "y1": 0.2123
      },
      "confidence": 1,
      "warnings": []
    },
    {
      "page": 1,
      "row_index": 1,
      "analyte_label": "Fibrinogen",
      "value_text": "354",
      "value_numeric": 354,
      "comparator": null,
      "unit_text": "mg/dL",
      "reference_range_text": "200 - 400",
      "ref_low": 200,
      "ref_high": 400,
      "printed_flag": null,
      "specimen_type": "Citrate plasma",
      "collected_at": "2025-06-02T07:52",
      "reported_at": "2025-06-03T12:09",
      "laboratory": "Quillmarsh Reference Lab",
      "evidence_text": "Fibrinogen Result: 354 mg/dL Reference: 200 - 400",
      "bbox": {
        "x0": 0.0654,
        "y0": 0.2287,
        "x1": 0.5466,
        "y1": 0.2553
      },
      "confidence": 1,
      "warnings": []
    },
    {
      "page": 1,
      "row_index": 2,
      "analyte_label": "Prothrombin Time",
      "value_text": "12.7",
      "value_numeric": 12.7,
      "comparator": null,
      "unit_text": "s",
      "reference_range_text": "11.0 - 13.5",
      "ref_low": 11,
      "ref_high": 13.5,
      "printed_flag": null,
      "specimen_type": "Citrate plasma",
      "collected_at": "2025-06-02T07:52",
      "reported_at": "2025-06-03T12:09",
      "laboratory": "Quillmarsh Reference Lab",
      "evidence_text": "Prothrombin Time Result: 12.7 s Reference: 11.0 - 13.5",
      "bbox": {
        "x0": 0.0654,
        "y0": 0.2717,
        "x1": 0.5548,
        "y1": 0.2982
      },
      "confidence": 1,
      "warnings": []
    },
    {
      "page": 1,
      "row_index": 3,
      "analyte_label": "INR",
      "value_text": "1.0",
      "value_numeric": 1,
      "comparator": null,
      "unit_text": null,
      "reference_range_text": "0.8 - 1.2",
      "ref_low": 0.8,
      "ref_high": 1.2,
      "printed_flag": null,
      "specimen_type": "Citrate plasma",
      "collected_at": "2025-06-02T07:52",
      "reported_at": "2025-06-03T12:09",
      "laboratory": "Quillmarsh Reference Lab",
      "evidence_text": "INR Result: 1.0 Reference: 0.8 - 1.2",
      "bbox": {
        "x0": 0.0654,
        "y0": 0.3146,
        "x1": 0.5385,
        "y1": 0.3411
      },
      "confidence": 1,
      "warnings": []
    },
    {
      "page": 1,
      "row_index": 4,
      "analyte_label": "aPTT",
      "value_text": "30",
      "value_numeric": 30,
      "comparator": null,
      "unit_text": "s",
      "reference_range_text": "25 - 35",
      "ref_low": 25,
      "ref_high": 35,
      "printed_flag": null,
      "specimen_type": "Citrate plasma",
      "collected_at": "2025-06-02T07:52",
      "reported_at": "2025-06-03T12:09",
      "laboratory": "Quillmarsh Reference Lab",
      "evidence_text": "aPTT Result: 30 s Reference: 25 - 35",
      "bbox": {
        "x0": 0.0654,
        "y0": 0.3575,
        "x1": 0.5303,
        "y1": 0.384
      },
      "confidence": 1,
      "warnings": []
    },
    {
      "page": 1,
      "row_index": 5,
      "analyte_label": "C-Reactive Protein, high sensitivity",
      "value_text": "< 0.2",
      "value_numeric": 0.2,
      "comparator": "<",
      "unit_text": "mg/L",
      "reference_range_text": "< 3.0",
      "ref_low": null,
      "ref_high": 3,
      "printed_flag": null,
      "specimen_type": "Serum",
      "collected_at": "2025-06-02T07:52",
      "reported_at": "2025-06-03T12:09",
      "laboratory": "Quillmarsh Reference Lab",
      "evidence_text": "C-Reactive Protein, high sensitivity Result: < 0.2 mg/L Reference: < 3.0",
      "bbox": {
        "x0": 0.0654,
        "y0": 0.4232,
        "x1": 0.5176,
        "y1": 0.4497
      },
      "confidence": 1,
      "warnings": []
    },
    {
      "page": 1,
      "row_index": 6,
      "analyte_label": "Interleukin-6",
      "value_text": "6.6",
      "value_numeric": 6.6,
      "comparator": null,
      "unit_text": "pg/mL",
      "reference_range_text": "≤ 7.0",
      "ref_low": null,
      "ref_high": 7,
      "printed_flag": null,
      "specimen_type": "Serum",
      "collected_at": "2025-06-02T07:52",
      "reported_at": "2025-06-03T12:09",
      "laboratory": "Quillmarsh Reference Lab",
      "evidence_text": "Interleukin-6 Result: 6.6 pg/mL Reference: ≤ 7.0",
      "bbox": {
        "x0": 0.0654,
        "y0": 0.4661,
        "x1": 0.5171,
        "y1": 0.4926
      },
      "confidence": 1,
      "warnings": []
    },
    {
      "page": 1,
      "row_index": 7,
      "analyte_label": "Ferritin",
      "value_text": "307",
      "value_numeric": 307,
      "comparator": null,
      "unit_text": "ng/mL",
      "reference_range_text": "24 - 336",
      "ref_low": 24,
      "ref_high": 336,
      "printed_flag": null,
      "specimen_type": "Serum",
      "collected_at": "2025-06-02T07:52",
      "reported_at": "2025-06-03T12:09",
      "laboratory": "Quillmarsh Reference Lab",
      "evidence_text": "Ferritin Result: 307 ng/mL Reference: 24 - 336",
      "bbox": {
        "x0": 0.0654,
        "y0": 0.509,
        "x1": 0.5385,
        "y1": 0.5356
      },
      "confidence": 1,
      "warnings": []
    },
    {
      "page": 1,
      "row_index": 8,
      "analyte_label": "Homocysteine",
      "value_text": "5.5",
      "value_numeric": 5.5,
      "comparator": null,
      "unit_text": "µmol/L",
      "reference_range_text": "≤ 15.0",
      "ref_low": null,
      "ref_high": 15,
      "printed_flag": null,
      "specimen_type": "Serum",
      "collected_at": "2025-06-02T07:52",
      "reported_at": "2025-06-03T12:09",
      "laboratory": "Quillmarsh Reference Lab",
      "evidence_text": "Homocysteine Result: 5.5 µmol/L Reference: ≤ 15.0",
      "bbox": {
        "x0": 0.0654,
        "y0": 0.552,
        "x1": 0.5253,
        "y1": 0.5785
      },
      "confidence": 1,
      "warnings": []
    }
  ],
  "warnings": []
}
