{
  "schema": "vitamux.lab.extraction/1",
  "synthetic": true,
  "document": {
    "laboratory": "Saltmere Clinical Lab",
    "specimen_type": "Urine, Serum",
    "collected_at": "2025-06-09T10:14",
    "collected_at_text": "Jun 9, 2025 10:14 AM",
    "reported_at": "2025-06-10T15:08",
    "reported_at_text": "Jun 10, 2025 3:08 PM",
    "page_count": 1
  },
  "rows": [
    {
      "page": 1,
      "row_index": 0,
      "analyte_label": "Color",
      "value_text": "Yellow",
      "value_numeric": null,
      "comparator": null,
      "unit_text": null,
      "reference_range_text": "Yellow",
      "ref_low": null,
      "ref_high": null,
      "printed_flag": null,
      "specimen_type": "Urine",
      "collected_at": "2025-06-09T10:14",
      "reported_at": "2025-06-10T15:08",
      "laboratory": "Saltmere Clinical Lab",
      "evidence_text": "Color Yellow Yellow",
      "bbox": {
        "x0": 0.0654,
        "y0": 0.2237,
        "x1": 0.6479,
        "y1": 0.2351
      },
      "confidence": 1,
      "warnings": []
    },
    {
      "page": 1,
      "row_index": 1,
      "analyte_label": "Appearance",
      "value_text": "Clear",
      "value_numeric": null,
      "comparator": null,
      "unit_text": null,
      "reference_range_text": "Clear",
      "ref_low": null,
      "ref_high": null,
      "printed_flag": null,
      "specimen_type": "Urine",
      "collected_at": "2025-06-09T10:14",
      "reported_at": "2025-06-10T15:08",
      "laboratory": "Saltmere Clinical Lab",
      "evidence_text": "Appearance Clear Clear",
      "bbox": {
        "x0": 0.0654,
        "y0": 0.2414,
        "x1": 0.6397,
        "y1": 0.2527
      },
      "confidence": 1,
      "warnings": []
    },
    {
      "page": 1,
      "row_index": 2,
      "analyte_label": "Specific Gravity",
      "value_text": "1.027",
      "value_numeric": 1.027,
      "comparator": null,
      "unit_text": null,
      "reference_range_text": "1.005-1.030",
      "ref_low": 1.005,
      "ref_high": 1.03,
      "printed_flag": null,
      "specimen_type": "Urine",
      "collected_at": "2025-06-09T10:14",
      "reported_at": "2025-06-10T15:08",
      "laboratory": "Saltmere Clinical Lab",
      "evidence_text": "Specific Gravity 1.027 1.005-1.030",
      "bbox": {
        "x0": 0.0654,
        "y0": 0.259,
        "x1": 0.6831,
        "y1": 0.2704
      },
      "confidence": 1,
      "warnings": []
    },
    {
      "page": 1,
      "row_index": 3,
      "analyte_label": "pH",
      "value_text": "5.6",
      "value_numeric": 5.6,
      "comparator": null,
      "unit_text": null,
      "reference_range_text": "5.0-8.0",
      "ref_low": 5,
      "ref_high": 8,
      "printed_flag": null,
      "specimen_type": "Urine",
      "collected_at": "2025-06-09T10:14",
      "reported_at": "2025-06-10T15:08",
      "laboratory": "Saltmere Clinical Lab",
      "evidence_text": "pH 5.6 5.0-8.0",
      "bbox": {
        "x0": 0.0654,
        "y0": 0.2767,
        "x1": 0.6504,
        "y1": 0.2881
      },
      "confidence": 1,
      "warnings": []
    },
    {
      "page": 1,
      "row_index": 4,
      "analyte_label": "Protein",
      "value_text": "Negative",
      "value_numeric": null,
      "comparator": null,
      "unit_text": null,
      "reference_range_text": "Negative",
      "ref_low": null,
      "ref_high": null,
      "printed_flag": null,
      "specimen_type": "Urine",
      "collected_at": "2025-06-09T10:14",
      "reported_at": "2025-06-10T15:08",
      "laboratory": "Saltmere Clinical Lab",
      "evidence_text": "Protein Negative Negative",
      "bbox": {
        "x0": 0.0654,
        "y0": 0.2944,
        "x1": 0.6626,
        "y1": 0.3058
      },
      "confidence": 1,
      "warnings": []
    },
    {
      "page": 1,
      "row_index": 5,
      "analyte_label": "Glucose",
      "value_text": "Negative",
      "value_numeric": null,
      "comparator": null,
      "unit_text": null,
      "reference_range_text": "Negative",
      "ref_low": null,
      "ref_high": null,
      "printed_flag": null,
      "specimen_type": "Urine",
      "collected_at": "2025-06-09T10:14",
      "reported_at": "2025-06-10T15:08",
      "laboratory": "Saltmere Clinical Lab",
      "evidence_text": "Glucose Negative Negative",
      "bbox": {
        "x0": 0.0654,
        "y0": 0.3121,
        "x1": 0.6626,
        "y1": 0.3234
      },
      "confidence": 1,
      "warnings": []
    },
    {
      "page": 1,
      "row_index": 6,
      "analyte_label": "Ketones",
      "value_text": "Trace",
      "value_numeric": null,
      "comparator": null,
      "unit_text": null,
      "reference_range_text": "Negative",
      "ref_low": null,
      "ref_high": null,
      "printed_flag": "*",
      "specimen_type": "Urine",
      "collected_at": "2025-06-09T10:14",
      "reported_at": "2025-06-10T15:08",
      "laboratory": "Saltmere Clinical Lab",
      "evidence_text": "Ketones Trace Negative *",
      "bbox": {
        "x0": 0.0654,
        "y0": 0.3297,
        "x1": 0.79,
        "y1": 0.3411
      },
      "confidence": 1,
      "warnings": []
    },
    {
      "page": 1,
      "row_index": 7,
      "analyte_label": "Blood",
      "value_text": "Negative",
      "value_numeric": null,
      "comparator": null,
      "unit_text": null,
      "reference_range_text": "Negative",
      "ref_low": null,
      "ref_high": null,
      "printed_flag": null,
      "specimen_type": "Urine",
      "collected_at": "2025-06-09T10:14",
      "reported_at": "2025-06-10T15:08",
      "laboratory": "Saltmere Clinical Lab",
      "evidence_text": "Blood Negative Negative",
      "bbox": {
        "x0": 0.0654,
        "y0": 0.3474,
        "x1": 0.6626,
        "y1": 0.3588
      },
      "confidence": 1,
      "warnings": []
    },
    {
      "page": 1,
      "row_index": 8,
      "analyte_label": "WBC",
      "value_text": "0-2",
      "value_numeric": null,
      "comparator": null,
      "unit_text": "/HPF",
      "reference_range_text": "0-5",
      "ref_low": 0,
      "ref_high": 5,
      "printed_flag": null,
      "specimen_type": "Urine",
      "collected_at": "2025-06-09T10:14",
      "reported_at": "2025-06-10T15:08",
      "laboratory": "Saltmere Clinical Lab",
      "evidence_text": "WBC 0-2 /HPF 0-5",
      "bbox": {
        "x0": 0.0654,
        "y0": 0.3651,
        "x1": 0.6258,
        "y1": 0.3765
      },
      "confidence": 1,
      "warnings": []
    },
    {
      "page": 1,
      "row_index": 9,
      "analyte_label": "ANA Screen, IFA",
      "value_text": "Positive",
      "value_numeric": null,
      "comparator": null,
      "unit_text": null,
      "reference_range_text": "Negative",
      "ref_low": null,
      "ref_high": null,
      "printed_flag": "*",
      "specimen_type": "Serum",
      "collected_at": "2025-06-09T10:14",
      "reported_at": "2025-06-10T15:08",
      "laboratory": "Saltmere Clinical Lab",
      "evidence_text": "ANA Screen, IFA Positive Negative *",
      "bbox": {
        "x0": 0.0654,
        "y0": 0.4257,
        "x1": 0.79,
        "y1": 0.4371
      },
      "confidence": 1,
      "warnings": []
    },
    {
      "page": 1,
      "row_index": 10,
      "analyte_label": "ANA Titer",
      "value_text": "1:160",
      "value_numeric": null,
      "comparator": null,
      "unit_text": null,
      "reference_range_text": "<1:80",
      "ref_low": null,
      "ref_high": null,
      "printed_flag": "*",
      "specimen_type": "Serum",
      "collected_at": "2025-06-09T10:14",
      "reported_at": "2025-06-10T15:08",
      "laboratory": "Saltmere Clinical Lab",
      "evidence_text": "ANA Titer 1:160 <1:80 *",
      "bbox": {
        "x0": 0.0654,
        "y0": 0.4434,
        "x1": 0.79,
        "y1": 0.4547
      },
      "confidence": 1,
      "warnings": []
    },
    {
      "page": 1,
      "row_index": 11,
      "analyte_label": "Rheumatoid Factor",
      "value_text": "<10",
      "value_numeric": 10,
      "comparator": "<",
      "unit_text": "IU/mL",
      "reference_range_text": "<14",
      "ref_low": null,
      "ref_high": 14,
      "printed_flag": null,
      "specimen_type": "Serum",
      "collected_at": "2025-06-09T10:14",
      "reported_at": "2025-06-10T15:08",
      "laboratory": "Saltmere Clinical Lab",
      "evidence_text": "Rheumatoid Factor <10 IU/mL <14",
      "bbox": {
        "x0": 0.0654,
        "y0": 0.4611,
        "x1": 0.6295,
        "y1": 0.4724
      },
      "confidence": 1,
      "warnings": []
    },
    {
      "page": 1,
      "row_index": 12,
      "analyte_label": "Galectin-3",
      "value_text": "10.4",
      "value_numeric": 10.4,
      "comparator": null,
      "unit_text": "ng/mL",
      "reference_range_text": "≤17.8",
      "ref_low": null,
      "ref_high": 17.8,
      "printed_flag": null,
      "specimen_type": "Serum",
      "collected_at": "2025-06-09T10:14",
      "reported_at": "2025-06-10T15:08",
      "laboratory": "Saltmere Clinical Lab",
      "evidence_text": "Galectin-3 10.4 ng/mL ≤17.8",
      "bbox": {
        "x0": 0.0654,
        "y0": 0.4787,
        "x1": 0.6413,
        "y1": 0.4901
      },
      "confidence": 1,
      "warnings": []
    }
  ],
  "warnings": []
}
