{
  "schema": "vitamux.lab.extraction/1",
  "synthetic": true,
  "document": {
    "laboratory": "Halvorine Laboratories",
    "specimen_type": "Serum",
    "collected_at": null,
    "collected_at_text": "10/09/2025 09:31",
    "reported_at": null,
    "reported_at_text": "11/09/2025 12:56",
    "page_count": 1
  },
  "rows": [
    {
      "page": 1,
      "row_index": 0,
      "analyte_label": "TSH",
      "value_text": "0.68",
      "value_numeric": 0.68,
      "comparator": null,
      "unit_text": "mIU/L",
      "reference_range_text": "0.27 – 4.20",
      "ref_low": 0.27,
      "ref_high": 4.2,
      "printed_flag": null,
      "specimen_type": "Serum",
      "collected_at": null,
      "reported_at": null,
      "laboratory": "Halvorine Laboratories",
      "evidence_text": "TSH: 0.68 mIU/L (Ref. 0.27 – 4.20)",
      "bbox": {
        "x0": 0.0672,
        "y0": 0.1914,
        "x1": 0.3102,
        "y1": 0.2021
      },
      "confidence": 1,
      "warnings": []
    },
    {
      "page": 1,
      "row_index": 1,
      "analyte_label": "Free T4",
      "value_text": "14.1",
      "value_numeric": 14.1,
      "comparator": null,
      "unit_text": "pmol/L",
      "reference_range_text": "12.0 – 22.0",
      "ref_low": 12,
      "ref_high": 22,
      "printed_flag": null,
      "specimen_type": "Serum",
      "collected_at": null,
      "reported_at": null,
      "laboratory": "Halvorine Laboratories",
      "evidence_text": "Free T4: 14.1 pmol/L (Ref. 12.0 – 22.0)",
      "bbox": {
        "x0": 0.0672,
        "y0": 0.208,
        "x1": 0.338,
        "y1": 0.2187
      },
      "confidence": 1,
      "warnings": []
    },
    {
      "page": 1,
      "row_index": 2,
      "analyte_label": "Free T3",
      "value_text": "4.3",
      "value_numeric": 4.3,
      "comparator": null,
      "unit_text": "pmol/L",
      "reference_range_text": "3.1 – 6.8",
      "ref_low": 3.1,
      "ref_high": 6.8,
      "printed_flag": null,
      "specimen_type": "Serum",
      "collected_at": null,
      "reported_at": null,
      "laboratory": "Halvorine Laboratories",
      "evidence_text": "Free T3: 4.3 pmol/L (Ref. 3.1 – 6.8)",
      "bbox": {
        "x0": 0.0672,
        "y0": 0.2247,
        "x1": 0.3127,
        "y1": 0.2353
      },
      "confidence": 1,
      "warnings": []
    },
    {
      "page": 1,
      "row_index": 3,
      "analyte_label": "Anti-TPO",
      "value_text": "< 9.0",
      "value_numeric": 9,
      "comparator": "<",
      "unit_text": "IU/mL",
      "reference_range_text": "< 34",
      "ref_low": null,
      "ref_high": 34,
      "printed_flag": null,
      "specimen_type": "Serum",
      "collected_at": null,
      "reported_at": null,
      "laboratory": "Halvorine Laboratories",
      "evidence_text": "Anti-TPO: < 9.0 IU/mL (Ref. < 34)",
      "bbox": {
        "x0": 0.0672,
        "y0": 0.2413,
        "x1": 0.3009,
        "y1": 0.252
      },
      "confidence": 1,
      "warnings": []
    },
    {
      "page": 1,
      "row_index": 4,
      "analyte_label": "Vitamin B12",
      "value_text": "> 1476",
      "value_numeric": 1476,
      "comparator": ">",
      "unit_text": "pmol/L",
      "reference_range_text": "145 – 569",
      "ref_low": 145,
      "ref_high": 569,
      "printed_flag": "H",
      "specimen_type": "Serum",
      "collected_at": null,
      "reported_at": null,
      "laboratory": "Halvorine Laboratories",
      "evidence_text": "Vitamin B12: > 1476 pmol/L (Ref. 145 – 569) H",
      "bbox": {
        "x0": 0.0672,
        "y0": 0.2793,
        "x1": 0.3989,
        "y1": 0.29
      },
      "confidence": 1,
      "warnings": []
    },
    {
      "page": 1,
      "row_index": 5,
      "analyte_label": "Testosterone",
      "value_text": "21.5",
      "value_numeric": 21.5,
      "comparator": null,
      "unit_text": "nmol/L",
      "reference_range_text": "8.6 – 29.0",
      "ref_low": 8.6,
      "ref_high": 29,
      "printed_flag": null,
      "specimen_type": "Serum",
      "collected_at": null,
      "reported_at": null,
      "laboratory": "Halvorine Laboratories",
      "evidence_text": "Testosterone: 21.5 nmol/L (Ref. 8.6 – 29.0)",
      "bbox": {
        "x0": 0.0672,
        "y0": 0.2959,
        "x1": 0.3649,
        "y1": 0.3066
      },
      "confidence": 1,
      "warnings": []
    },
    {
      "page": 1,
      "row_index": 6,
      "analyte_label": "SHBG",
      "value_text": "41.7",
      "value_numeric": 41.7,
      "comparator": null,
      "unit_text": "nmol/L",
      "reference_range_text": "18.3 – 54.1",
      "ref_low": 18.3,
      "ref_high": 54.1,
      "printed_flag": null,
      "specimen_type": "Serum",
      "collected_at": null,
      "reported_at": null,
      "laboratory": "Halvorine Laboratories",
      "evidence_text": "SHBG: 41.7 nmol/L (Ref. 18.3 – 54.1)",
      "bbox": {
        "x0": 0.0672,
        "y0": 0.3125,
        "x1": 0.3279,
        "y1": 0.3232
      },
      "confidence": 1,
      "warnings": []
    },
    {
      "page": 1,
      "row_index": 7,
      "analyte_label": "Cortisol (08:00)",
      "value_text": "207",
      "value_numeric": 207,
      "comparator": null,
      "unit_text": "nmol/L",
      "reference_range_text": "166 – 507",
      "ref_low": 166,
      "ref_high": 507,
      "printed_flag": null,
      "specimen_type": "Serum",
      "collected_at": null,
      "reported_at": null,
      "laboratory": "Halvorine Laboratories",
      "evidence_text": "Cortisol (08:00): 207 nmol/L (Ref. 166 – 507)",
      "bbox": {
        "x0": 0.0672,
        "y0": 0.3292,
        "x1": 0.3758,
        "y1": 0.3399
      },
      "confidence": 1,
      "warnings": []
    },
    {
      "page": 1,
      "row_index": 8,
      "analyte_label": "25-OH Vitamin D",
      "value_text": "120",
      "value_numeric": 120,
      "comparator": null,
      "unit_text": "nmol/L",
      "reference_range_text": "50 – 175",
      "ref_low": 50,
      "ref_high": 175,
      "printed_flag": null,
      "specimen_type": "Serum",
      "collected_at": null,
      "reported_at": null,
      "laboratory": "Halvorine Laboratories",
      "evidence_text": "25-OH Vitamin D: 120 nmol/L (Ref. 50 – 175)",
      "bbox": {
        "x0": 0.0672,
        "y0": 0.3458,
        "x1": 0.3783,
        "y1": 0.3565
      },
      "confidence": 1,
      "warnings": []
    },
    {
      "page": 1,
      "row_index": 9,
      "analyte_label": "Prolactin",
      "value_text": "7.2",
      "value_numeric": 7.2,
      "comparator": null,
      "unit_text": "µg/L",
      "reference_range_text": "4.0 – 15.2",
      "ref_low": 4,
      "ref_high": 15.2,
      "printed_flag": null,
      "specimen_type": "Serum",
      "collected_at": null,
      "reported_at": null,
      "laboratory": "Halvorine Laboratories",
      "evidence_text": "Prolactin: 7.2 µg/L (Ref. 4.0 – 15.2)",
      "bbox": {
        "x0": 0.0672,
        "y0": 0.3624,
        "x1": 0.3111,
        "y1": 0.3731
      },
      "confidence": 1,
      "warnings": []
    }
  ],
  "warnings": []
}
