{
  "schema": "vitamux.lab.extraction/1",
  "synthetic": true,
  "document": {
    "laboratory": "Thistlebrook Laboratory",
    "specimen_type": "Serum",
    "collected_at": "2025-06-29T10:08",
    "collected_at_text": "2025-06-29 10:08",
    "reported_at": "2025-06-30T12:42",
    "reported_at_text": "2025-06-30 12:42",
    "page_count": 1
  },
  "rows": [
    {
      "page": 1,
      "row_index": 0,
      "analyte_label": "Iron",
      "value_text": "24",
      "value_numeric": 24,
      "comparator": null,
      "unit_text": "umol/L",
      "reference_range_text": "10 - 30",
      "ref_low": 10,
      "ref_high": 30,
      "printed_flag": null,
      "specimen_type": "Serum",
      "collected_at": "2025-06-29T10:08",
      "reported_at": "2025-06-30T12:42",
      "laboratory": "Thistlebrook Laboratory",
      "evidence_text": "Iron 24 umol/L 10 - 30",
      "bbox": {
        "x0": 0.0672,
        "y0": 0.2221,
        "x1": 0.6454,
        "y1": 0.2375
      },
      "confidence": 1,
      "warnings": []
    },
    {
      "page": 1,
      "row_index": 1,
      "analyte_label": "Transferrin",
      "value_text": "2.7",
      "value_numeric": 2.7,
      "comparator": null,
      "unit_text": "g/L",
      "reference_range_text": "2.0 - 3.6",
      "ref_low": 2,
      "ref_high": 3.6,
      "printed_flag": null,
      "specimen_type": "Serum",
      "collected_at": "2025-06-29T10:08",
      "reported_at": "2025-06-30T12:42",
      "laboratory": "Thistlebrook Laboratory",
      "evidence_text": "Transferrin 2.7 g/L 2.0 - 3.6",
      "bbox": {
        "x0": 0.0672,
        "y0": 0.2458,
        "x1": 0.6689,
        "y1": 0.2613
      },
      "confidence": 1,
      "warnings": []
    },
    {
      "page": 1,
      "row_index": 2,
      "analyte_label": "Transferrin saturation",
      "value_text": "38",
      "value_numeric": 38,
      "comparator": null,
      "unit_text": "%",
      "reference_range_text": "20 - 50",
      "ref_low": 20,
      "ref_high": 50,
      "printed_flag": null,
      "specimen_type": "Serum",
      "collected_at": "2025-06-29T10:08",
      "reported_at": "2025-06-30T12:42",
      "laboratory": "Thistlebrook Laboratory",
      "evidence_text": "Transferrin saturation 38 % 20 - 50",
      "bbox": {
        "x0": 0.0672,
        "y0": 0.2696,
        "x1": 0.6454,
        "y1": 0.285
      },
      "confidence": 1,
      "warnings": []
    },
    {
      "page": 1,
      "row_index": 3,
      "analyte_label": "Ferritin",
      "value_text": "176",
      "value_numeric": 176,
      "comparator": null,
      "unit_text": "ug/L",
      "reference_range_text": "30 - 400",
      "ref_low": 30,
      "ref_high": 400,
      "printed_flag": null,
      "specimen_type": "Serum",
      "collected_at": "2025-06-29T10:08",
      "reported_at": "2025-06-30T12:42",
      "laboratory": "Thistlebrook Laboratory",
      "evidence_text": "Ferritin 176 ug/L 30 - 400",
      "bbox": {
        "x0": 0.0672,
        "y0": 0.2933,
        "x1": 0.6571,
        "y1": 0.3088
      },
      "confidence": 1,
      "warnings": []
    },
    {
      "page": 1,
      "row_index": 4,
      "analyte_label": "Vitamin D (25-OH)",
      "value_text": null,
      "value_numeric": null,
      "comparator": null,
      "unit_text": "nmol/L",
      "reference_range_text": "50 - 175",
      "ref_low": 50,
      "ref_high": 175,
      "printed_flag": null,
      "specimen_type": "Serum",
      "collected_at": "2025-06-29T10:08",
      "reported_at": "2025-06-30T12:42",
      "laboratory": "Thistlebrook Laboratory",
      "evidence_text": "Vitamin D (25-OH) nmol/L 50 - 175",
      "bbox": {
        "x0": 0.0672,
        "y0": 0.3171,
        "x1": 0.6571,
        "y1": 0.3325
      },
      "confidence": 1,
      "warnings": [
        "unreadable_value"
      ]
    },
    {
      "page": 1,
      "row_index": 5,
      "analyte_label": "Vitamin B12",
      "value_text": "384",
      "value_numeric": 384,
      "comparator": null,
      "unit_text": "pmol/L",
      "reference_range_text": "145 - 569",
      "ref_low": 145,
      "ref_high": 569,
      "printed_flag": null,
      "specimen_type": "Serum",
      "collected_at": "2025-06-29T10:08",
      "reported_at": "2025-06-30T12:42",
      "laboratory": "Thistlebrook Laboratory",
      "evidence_text": "Vitamin B12 384 pmol/L 145 - 569",
      "bbox": {
        "x0": 0.0672,
        "y0": 0.3409,
        "x1": 0.6689,
        "y1": 0.3563
      },
      "confidence": 1,
      "warnings": []
    },
    {
      "page": 1,
      "row_index": 6,
      "analyte_label": "Folate",
      "value_text": "8.1",
      "value_numeric": 8.1,
      "comparator": null,
      "unit_text": "nmol/L",
      "reference_range_text": "> 7.0",
      "ref_low": 7,
      "ref_high": null,
      "printed_flag": null,
      "specimen_type": "Serum",
      "collected_at": "2025-06-29T10:08",
      "reported_at": "2025-06-30T12:42",
      "laboratory": "Thistlebrook Laboratory",
      "evidence_text": "Folate 8.1 nmol/L > 7.0",
      "bbox": {
        "x0": 0.0672,
        "y0": 0.3646,
        "x1": 0.6218,
        "y1": 0.38
      },
      "confidence": 1,
      "warnings": []
    },
    {
      "page": 1,
      "row_index": 7,
      "analyte_label": "Zinc",
      "value_text": "19",
      "value_numeric": 19,
      "comparator": null,
      "unit_text": "umol/L",
      "reference_range_text": "11 - 18",
      "ref_low": 11,
      "ref_high": 18,
      "printed_flag": "H",
      "specimen_type": "Serum",
      "collected_at": "2025-06-29T10:08",
      "reported_at": "2025-06-30T12:42",
      "laboratory": "Thistlebrook Laboratory",
      "evidence_text": "Zinc 19 umol/L 11 - 18 H",
      "bbox": {
        "x0": 0.0672,
        "y0": 0.3884,
        "x1": 0.7345,
        "y1": 0.4038
      },
      "confidence": 1,
      "warnings": []
    }
  ],
  "warnings": []
}
